,tweetText,replyCount,quoteCount,retweetCount,likeCount,views,bookmarkCount,like_to_view_ratio
179,Pursuing your curiosity is the transition from a life of doing what others tell you to doing what you enjoy.,144,15,187,1373,69696,182,0.019699839
664,"You can't improve what doesn't exist.

Don't horde ideas in your distracted mind. Don't stash your plans in a forgotten notebook. Don't mentally masturbate to tutorials &amp; advice.

Meaningful dopamine comes from building with your own two hands.

Real progress begins when you do.",95,15,141,989,50342,154,0.019645623932303048
13,"It breaks my heart to see so many starving artists because their ego refused to learn marketing and sales – thinking if they did, they'd have a big ego – so their work never had the potential of spreading beyond themselves.",181,15,134,1517,77397,285,0.019600243
700,"Everything is a skill.

Walking, speaking, writing, design, making money, business, dating, being social, nutrition, training.

Every skill is difficult until it becomes second nature. You aren't seeing the results you want because you distract yourself from daily practice.",94,15,425,1890,96478,287,0.019589958332469577
210,You're overwhelmed because your mind is living just far enough into the future that your next step feels unreachable.,155,14,429,3054,155948,594,0.019583450893887706
301,Your life sucks because your standards are so low that you are okay with your life sucking.,246,12,255,2146,109583,229,0.01958333
339,"People don't remember what you say, they remember how you make them feel.",128,19,238,1823,93407,107,0.019516738574196793
724,Weird becomes interesting when you're confident in your own skin.,116,7,161,1195,61258,66,0.019507656142871137
197,"Your mind takes the shape of its surroundings.

Be careful with how often you expose it to environments filled with mediocrity, mindlessness, and victim mentality.",173,26,443,2598,133179,447,0.01950758
258,"You aren't bored.

You're distracted.

Hopping from social media to the news to video games to junk food to numb your mind from the discomfort that life presents.

Distractions are finite.

Your potential is not.",188,11,376,2607,133744,438,0.019492463213303026
602,"An underrated skill is minding your own business.

It keeps you moving toward your goals.

It keeps you sane by not caring what others think.

It keeps you out of the trouble that comes with mindless conflict.

There are only a handful of good people that deserve your attention.",124,15,327,1513,77749,148,0.019460057364081854
214,"If you don’t want to do something, but you have to do it in order to do what you want, then you want to do it.",184,19,417,2875,147865,457,0.019443411
549,"“How long has it taken to build your physique?”

“How long has it taken to build your business?”

“How long has it taken to build your mindset?”

My entire life.

These aren’t “hobbies.”

They’re the foundation of your life.

Daily practice isn’t optional.",129,14,281,1885,97069,205,0.019419176
159,"At any given moment you are one book, post, video, word, sentence, paragraph, or conversation away from changing the direction of your life. The problem is that most people's problems aren't perceived as painful enough to be open to a new direction for their life.",145,8,199,1558,80340,303,0.019392581528503858
364,"You suck at writing because you don't understand human nature.

People don't want clever, they want clear.

People don't want a lecture, they want emotion.

People don't care about you, they care about themselves.

Write with this in mind and watch your readers pay attention.",221,18,674,4113,212283,1411,0.019375079492941028
486,"Sometimes a simple “fuck it, I’ll make it work” is all you need to start the snowball of momentum into a better life.",196,63,1412,6261,323542,536,0.019351429
126,"A pattern I've noticed in those who achieve great things:

They get obsessed with progress for short bursts of intense living after a vision for the future forms. Distractions don't have a chance at penetrating their focus.",123,7,223,1680,86903,426,0.019331898783701368
96,"Wake up, make coffee, 8 hours of work, entertain yourself, sleep, repeat for decades until you are given permission to replace work with more entertainment.

Sounds more robot than human.",171,11,195,1893,98089,241,0.019298800069324797
180,"A powerful frame of mind:

Treat everything you do or say as if you were going to die in one week, and reset the clock every morning so that week lasts a lifetime.",159,9,249,1859,96465,388,0.019271238
412,"One of the best compliments:

“I like the way your mind works.”",162,46,828,4487,233262,246,0.019235881
276,The only thing standing between where you are and where you want to be is a series of decisions that most people refuse to make.,236,28,461,2636,137287,353,0.019200653
178,"80% of living the life you want boils down to creating your own goals while most people are mindless slaves to society's goals.

Goals change how you interpret situations, which influences your actions, which programs your identity, which compounds over years into the good life.",137,13,339,2023,105416,442,0.019190635
468,The paradox of life is that everything is a disaster and yet everything is just fine. Where you focus your attention is the difference.,147,21,666,3161,165263,304,0.019127088
273,"Most successful creators started because they didn’t have anyone to talk to about their “weird” interests, so they found those people online.",188,26,158,1676,87662,169,0.019118888457940728
260,Most of your problems aren’t problems. They’re a temporary emotional wave that normalizes with time.,235,25,543,3346,175671,368,0.019046968480853414
98,"There are 2 results from making mistakes:

1) Death by 1,000 paper cuts
2) Success by 1,000 failures

You are either a slave to or the master of the lessons that life presents at any low point of your life.",117,4,88,821,43126,139,0.019037239716180494
24,"The Art of Focus has been out for 4 days.

5600+ copies have been sold across digital, paperback, and audiobook versions.

Previously we sold 1700 Keepsake copies.

7300+ copies of the book are out circulating the world.

It was a childhood dream to become an author.

Thank you. https://t.co/nB4kfFhY13",189,10,75,1330,69915,134,0.019023099477937497
131,"When you have your priorities straight, 3-4 hours is more than enough time to finish your work for the day.",228,33,413,3442,181187,495,0.018996947904650997
170,"Write about your weaknesses.

Give yourself advice. Identify gaps in your thinking. Educate yourself on how to overcome them. Talk to yourself in public and let others benefit from your improvement.

Writing is how you gain awareness, authority, and clarity with one simple habit.",138,17,469,2740,144325,936,0.018984929845834057
147,"Become absolutely clear on:

- What you want (goal &amp; aim)
- How to get there (plan &amp; clarity)
- Why you want to (intention &amp; desire)

Most are stuck because they are assigned a goal they don’t want, given a plan that isn’t clear, and have zero desire to live someone else’s life.",148,12,633,3232,170247,1533,0.018984181806434183
254,"Your mind is a supercomputer.

Your attention is the RAM.

Thoughts, regrets, and tasks are the programs slowing your performance.

Writing, mindfulness, and focus are the reboot you can access at any time.",145,8,462,2602,137180,579,0.01896778
190,"You won’t make it without obsession.

But nobody starts out obsessed. They start out curious. They experiment. They build things. They break things, They fail. And eventually they can’t pull themselves away.

Curiosity turns into obsession with time and persistence.",176,28,796,4582,241640,1011,0.018962092368813112
86,Calmness is an always accessible state of mind that diffuses negative emotions and encourages positive ones.,180,4,215,1374,72510,142,0.01894911
405,Don’t apologize for offending people that can’t see the future that you do.,163,17,279,1693,89355,66,0.018946897207766773
189,"If you don’t have ideas, read.

If you have ideas, but can’t articulate them, write.

If you have ideas, and the clarity to execute, build.

Expand, organize, and focus your mind until your craziest ideas become reality.",159,22,1171,5833,308018,1796,0.018937205
361,"How to get out of your own head:

You can’t.

You are never not in your own head.

It’s not about getting out of your head.

It’s about ordering, filtering, and managing your thoughts so you don’t drown in chaos, anxiety, and overwhelm.",163,11,269,1645,86881,216,0.018933944
409,The only difference between you and the person more successful than you is the consistent intention behind the information they consume.,180,25,436,2410,127343,252,0.018925264835915598
546,Optimists don't worry about the future because they're the ones building it.,122,20,304,1791,94721,129,0.018908161864845178
860,Surround yourself with people that know their potential and are working every day to make it reality.,139,9,217,1326,70146,66,0.018903429988880335
221,Long walks are the secret to a lean body and mind.,240,34,499,4073,215500,391,0.018900232018561485
306,The only person that can stop you from living a meaningless existence is yourself.,205,7,244,1623,85963,99,0.018880216
571,"The reason people fail is they can’t lift the emotional weights required to achieve the goals they set.

Ego lifting goes far beyond the gym.",102,6,241,1480,78454,146,0.018864557575139572
381,"You’ve been forgotten countless times by old friends, teachers, and people you used to consider close to you.

You will continue to be forgotten.

While most will use this to justify their poor choices, you can use it as confidence to pursue the dream you've been putting off.",144,13,305,1810,96070,212,0.018840428853960655
582,"I see employment as a stepping stone.

Jobs are useful for skill acquisition, status, and opportunity.

But getting stuck in one is dangerous for your psyche which is wired to hunt. You become a monkey in a cubicle. It is against your nature.

Entrepreneurship is modern survival.",122,7,249,1665,88402,202,0.018834416
596,"You don't have a time problem. You have a clarity, efficiency, and prioritization problem.",147,31,511,2841,150951,328,0.018820676908400738
1014,"Don’t expect to tap into your creative potential if you’re never alone with yourself.

No work, no people, no information.

Sit with yourself, let thoughts trigger thoughts, and follow them down a rabbit hole of original discovery.",128,14,189,1389,73811,97,0.018818333310753138
156,"If you aren't clear on what you want, you can't communicate what you want to others.

This sets you up for a life of assumptions, expectations, and never getting what you want out of life. Nobody can help you and you can't help yourself.",154,8,225,1583,84136,345,0.018814776076827994
257,"You need a plan.

There isn’t any other way.

Because if you don’t have one, society does, and they’ve been planning your life for decades.",245,26,522,2914,154945,447,0.018806673335699766
561,You are as stuck as your mind is closed and will remain stuck until you decide to change it.,124,12,176,1209,64309,91,0.018799856940708144
419,The only pain greater than seeing what you are capable of is not seeing what you are capable of.,147,11,166,1072,57127,75,0.018765207345038247
479,Your potential is only as far as your vision and most people can only see as far as someone says they can.,184,14,381,2154,114834,141,0.018757511
493,"You are writing the code in your head that runs your life.

The way you speak to yourself. The way you interpret what others say. The thoughts and emotions you give too much power over your actions.

The quality of your life depends on the quality of code you let stick around.",146,18,293,1672,89160,260,0.018752803947958727
617,"95% of your problems are solved by ignoring them, because most peoples problems aren’t real. Then, true problems become visible. Focus on those. That’s when you stop being distracted and start making progress.",96,14,235,1398,74685,140,0.018718618196424983
606,"It's difficult to be bored when push into the unknown, discover a new potential for your life, and accept that the only way to reach that potential is to learn, practice, and build until it becomes reality.",92,5,157,929,49647,87,0.018712107
122,Most people grow physically but not mentally because they get trapped in the comfortable path that society laid out for them at birth.,148,5,190,1307,69851,142,0.018711256818084207
39,"When your habits start to slip the effects are almost unnoticeable (making it seem like you didn't need them in the first place).

Slowly, then all at once, you'll wonder why you look, feel, and think like shit.",155,6,129,1167,62409,237,0.018699226073162524
737,Surround yourself with people that know their potential and won't accept anything less than an exceptional life.,141,7,236,1369,73225,77,0.018695800614544213
266,"If you aren't pushing your own boundaries in any area of life, you are not growing (and you are not staying the same).

You are slowly dying in a bubble of comfort, familiarity, and repetition.",189,14,332,2160,115580,402,0.018688354
672,"If you don't program your mind for success, it will be programmed for mediocrity.",155,17,521,2567,137372,186,0.018686486329091808
423,"If you don't even remember the last 10 posts you read:

1) Stop worrying about what people will think of your writing.

2) Write consistently, for years, because you'll be forgotten in an instant.

3) Repeat yourself often so your readers actually receive your main lessons.",154,5,117,1127,60312,155,0.018686165273909008
445,"If your goal is freedom, stop it with the side hustle obsession. ""Side hustle"" screams that you are thinking small and don't want to make more than you already do. Start a business to pursue your lifes work. Dedicate what time you have to it. See it through for a decade, minimum.",145,12,224,1780,95516,231,0.018635621257171574
464,"Nobody is coming to save you.

Not your friends.
Not your family.
Not the government

They can offer advice and tools.

But at the end of the day, it's up to you to change your mind, view your situation from a new perspective, and act regardless of how you feel.",223,72,1170,4723,253697,571,0.018616696295186776
193,"How to clear your mind:

Walk more. Read more. Write more. Listen more. Lift more. Strategize more. Build more.

Scroll less. Indulge less. Criticize less. Ruminate less. Sit less. Procrastinate less.

Clarity is reserved for those who don't resist reality, but engage with it.",185,31,1191,5849,314239,1948,0.018613221
722,Money is a necessary pursuit until the point where you can shift your focus to what you enjoy spending time on.,98,7,124,882,47403,67,0.018606417315359787
123,"Learning is eating, building is digesting.",157,11,175,1184,63639,105,0.018604944
7,"You have to do what you want to figure out what you don't want to realize what you actually want.

The problem:

Most people think they want infinite pleasure when their core is crying out for something deeper.

They ignore the call to greatness and never get what they want.",141,6,102,959,51580,210,0.018592478
282,The source of most people’s lack of fulfillment is that they’ve never learned or built something that they chose to learn or build.,180,15,192,1450,78002,194,0.018589266941873284
152,You cannot advance to a better phase of life until you learn the lesson that life is trying to teach you in this one.,172,20,422,2643,142228,370,0.018582838822172848
42,"The mind craves order and security.

Most schools lack trust.
Most jobs lack fulfillment.
Most churches lack openness.

Most of the routes that brought guidance and meaning to our lives have been poisoned with excessive politics and profits.

Your future lies in your hands. https://t.co/qiWS01hVZP",79,7,92,664,35743,166,0.018577064
251,"You don't need motivation or discipline when you are the person who would take certain actions.

A bodybuilder doesn't need motivation to eat healthy. A gamer doesn't need discipline to stare at a screen all day.

Your identity creates your future, for better or worse.",139,9,224,1736,93558,311,0.018555335
948,"The best thing you can do for yourself is accept that you fucked up, not let it happen again, and embody that state of mind through action.",112,5,234,1431,77151,116,0.018548042
454,"You start in this world with nothing.

The problem:

As children we don’t know any better.

We adopt the skills, beliefs, and goals that others project on us, limiting our individual power and potential.

The game of life starts when you decide to restart and play your own way.",167,9,334,1723,92917,193,0.018543431
411,"It’s rare to find people that accept you as you are. They don’t want to change you. They don’t want to convert you. They don’t want to persuade you. If they like you, they stay around. If they don’t, they move on without hesitation. Savor these people.",140,11,259,1594,85998,141,0.018535314774762203
238,Be careful telling people about your goals. It releases dopamine similar to achieving them. Don't tell people what you are going to do. Tell people what you are doing.,223,52,854,5534,298710,1088,0.018526329885172912
47,Your skill set isn’t valuable if nobody knows about it.,240,47,333,2564,138425,321,0.018522666
114,"For most young people, it's impossible to know what you want by the age of 20, so society tells you what you want, and you don't question it.",193,10,163,1510,81555,203,0.018515112500766356
388,"Once you accept that people are going to judge you no matter what you do, but know they will forget about you in 10 seconds because attention spans are abysmal, it becomes easy to stop caring what others think.",218,42,629,3143,169758,375,0.018514591
402,"You’re allowed to ignore the news, drama, shiny objects, and almost everything that doesn’t serve the goal that keeps bugging you to be achieved. Because achieving that goal will enable you to give back 10x the value of any short term distraction.",120,9,188,1206,65212,126,0.018493528798380666
235,Force yourself into uncomfortable situations so you don't end up being 50 years old with the emotional maturity of a 15 year old.,193,32,738,4724,255456,736,0.018492421395465364
528,"Your knowledge is limited if you only get it from books. Trial, error, and experience open a new realm of profitability that distracted people can't fathom.",169,21,232,1567,84805,124,0.018477684
181,"You struggle to write about anything you want because you don't know how to make your interests interesting to your readers, and you don't realize that people can (and want to) become interested in new things. People remember and trust those who introduce them to new interests.",99,6,94,1036,56095,212,0.018468669
263,"You need 3 things:

1) A purpose - an aim for your life.

2) A path - a series of goals to achieve.

3) A priority - a lever to pull today.

If any of these are assigned to you by society – and not by your own creation – you will not feel fulfilled.",158,15,675,3423,185561,1248,0.018446764136860656
504,"Humans are meant to transcend, expand, and create. The physical world only allowed for so much growth, so we went mental. We've built digital libraries, nations, and tribes to ease the transition into virtual reality - that way we can transcend into a largely mental world.",101,6,208,898,48757,67,0.018417868203540005
579,"Good dopamine comes from hunting in the unknown. Discovering resources to build your ideal future.

When you get a job, dopamine spikes, but then you get stuck in the known. Repeating tasks until death.

Entrepreneurship is how you continue pushing into the meaningful unknown.",82,7,195,1285,69770,187,0.018417658019205963
556,"It helps to think of any goal you want to achieve as landing a skateboard trick. Like when you were a kid. Spending hours failing, failing, failing to the end of your wits. Then when you least expect it, you nail it.

Nothing happens, then everything happens.",147,18,179,1282,69620,139,0.018414249
427,"It’s easy to get lost in a routine.

It’s easy to get lost in spontaneity.

One leads to boredom, the other to anxiety.

A healthy cycle of both keeps life fresh and meaningful.",132,6,147,1196,65159,90,0.018355100600070597
225,"Success is not about status.

Success is about solving creative problems.

Trying to be successful to look good for other people leads you down a false path and makes you neurotic.

It never ends.

Successfully solving problems that create progress leads to fulfillment.",165,12,227,1649,89907,282,0.018341174769484023
591,"If you don't have money to invest, invest your time.

Set a goal to reveal what you don't know.

Study the skills that will bridge the gap.

Practice like your future depends on it.

Give yourself 6 months.

Soon enough, you can invest money to buy back your time.",93,8,322,1664,90851,325,0.018315703734686464
451,"If you aren’t where you want to be in life the only three words you should focus on are build, iterate, and persist.",158,14,441,2709,147915,331,0.018314573
734,"Don’t forget that most of what you read, watch, or listen to is largely useless until tested against reality, in different situations, and with an open mind.",149,13,157,1075,58731,64,0.018303792
467,"Ideas are the building blocks of your future.

You must read, write, speak, contemplate, meditate, and break your habit with distractions that keep your mind depressed. That is the first step to a great life.

Then, relentlessly build with the ideas you filter as meaningful.",113,8,239,1444,78924,235,0.018296082307029546
192,"Your bad habits don’t seem worth quitting because you don’t have responsibilities (or prioritize those responsibilities) that deserve you at 100% capacity.

If the importance of those responsibilities outweighed the pleasure of your bad habits, you’d stop without question.",152,14,326,2049,112002,519,0.018294316172925484
80,"The backbone of good products, marketing, sales, self-improvement, and communication are tested systems for behavior change.

A system contains:

- A burning problem
- A desired outcome
- A path to get there
- A feedback mechanism

Anything you create, do it with this in mind.",104,5,118,946,51737,379,0.018284786516419585
526,"If you never contradict yourself, spark controversy, or make people feel uncomfortable you are not human. Instead, you are a robot programmed by a society that wants you soft and easy to control.",130,17,265,1550,84788,144,0.018280888805019577
403,"Don’t apologize for focusing on yourself.

It’s not selfish. Improving the value you have to offer is the most selfless thing you can do. But others will try to convince you to be like them. To give give give so they can fulfill the selfish need to feel good about themselves.",130,11,275,1481,81054,190,0.018271769437658843
512,"It bothers me how people can't understand that anything can be enjoyable.

Going to the gym, building a business, and cultivating a sovereign mind and body become enjoyable when you invest enough energy into them.

You don't need to poison yourself with pleasure to enjoy life.",170,13,320,1920,105115,179,0.018265708985396947
203,"The macronutrients of business:

- Brand
- Content
- Product
- Promotions

The micronutrients of business:

- Skill
- Creativity
- Knowledge
- Interests
- Experience
- Critical thinking
- Personality",112,6,246,1514,82945,439,0.018253059
717,1 hour of focus on the right thing is better than 14 hours of distraction on the wrong.,119,15,196,1364,74738,75,0.018250421472343386
386,"You don't have to chase pain and struggle, but you need to understand that you can't avoid it. There will be times in your life that suck, but they will suck less if you are aware that they're supposed to be there.",173,10,224,1379,75701,130,0.018216404010515053
413,"How to build a beautiful mind:

Train your mind like you would train your body, but with skill and information instead of weights and food.",135,5,273,1588,87241,166,0.018202451
284,"You don't have any interests because you haven't stepped into the unknown. All you know are the same goals, paths, and routines as everyone else. You haven't given yourself a chance to find your unique interests.",144,9,198,1475,81087,222,0.018190338771936314
584,"Reading is how you acquire new knowledge.

Reading is how you expand your worldview.

Reading is how you spot new opportunities.

Reading is how you train your focus.

Reading is how you absorb 10 years of experience in 8 hours.

When you're bored, pick up a book, not your phone.",196,42,539,2710,149110,321,0.018174502045469786
296,"If the good life is created by a series of high quality decisions, and high quality decisions only come from improvement after low quality decisions, then it is in your best interest to fail hard and often with a smile on your face.",177,14,276,1624,89377,199,0.018170222764245837
59,"If you're on the unconventional path, the best thing you can do is emulate others.

If you're on the conventional path, the worst thing you can do is emulate others.",157,6,93,1079,59398,163,0.018165594801171758
553,"You can’t plan for opportunities. They happen in an instant. And if you don’t have the vision, courage, or skill to take advantage of them, they will keep passing you by, and you will keep staying the same.",142,20,542,2352,129486,250,0.018164125851443398
45,"2 questions to a better life:

Who planted these goals in my head?
Am I sure I want to be pursuing them?",181,20,210,1619,89132,360,0.018164071265089978
28,"If you hate your work, and it comprises 1/3 of your life, and it drains your energy to enjoy the other 1/3, and you are asleep the other 1/3, there doesn't seem to be a higher priority than to build your own thing so you can quit building someone else’s.",137,11,209,1887,104111,452,0.018124885939045828
