,tweetText,replyCount,quoteCount,retweetCount,likeCount,views,bookmarkCount,like_to_view_ratio
588,"The new school system is composed of creators as teachers and consumers as students.

Anyone can learn skills that the old schools don't teach and leverage the internet to build a life they enjoy.

Or you can skip class, waste money, stay asleep, and let opportunity pass you by.",79,4,69,584,44964,64,0.012988168
785,Most people think they have to invest money and it prevents them from investing time in pursuits that make money.,88,7,52,583,44900,30,0.012984409799554565
977,"If you are bored, build.

If you are building, persist.

If you are persistent, trust.

The solution to boredom is a challenge that engages your mind with a meaningful pursuit.

The unconventional path is uncertain, but it's the only one where you don't end up like everyone else.",104,15,522,2730,210377,457,0.012976703727118458
142,"Write to yourself, build for yourself, sell to yourself.

When you solve your own problems and distribute the solution – you become the niche.

There aren't many shortcuts in business, but this is one of them:
https://t.co/UkJss5sSqj",61,5,72,656,50569,279,0.012972374
859,Force yourself into uncomfortable situations so you don't end up being 50 years old with the emotional maturity of a 15 year old.,185,58,765,4254,328015,451,0.012968919104309255
1259,"It's easier to know what you don't want (from experience) than what you want (from imagination).

The future is a cave. Self-reflection is your flashlight.",76,1,69,512,39490,51,0.012965307672828564
991,"Do what you love but study psychology, marketing, and sales so you don’t become a starving artist.",156,19,281,2062,159190,278,0.012953074941893334
168,"If your job is to target a specific person

and you are a specific person

why are you niching down to sell something you don't want to sell, to someone you don't like, just to get confused and quit after 2 weeks?

Build, write, and sell to yourself:
https://t.co/4r0DESs1D4",68,3,45,527,40698,175,0.012949039264828738
311,You feel helpless because you are unaware that there IS a series of choices you can make to get out of your situation.,172,18,322,2164,167145,290,0.012946842561847497
592,"Imagine having a mind and body with unfathomable limits and doing nothing but watch TV, go to work, and stare at your phone.

You were meant for more.",157,35,683,3262,252121,434,0.012938232039377918
1133,"People pay for transformations.

Stories imply a transformation, and yours is unique.

Games are structured stories that frame attention toward a goal, give clarity on how to achieve it, and incentivize positive action.

To earn more, gamify your content, product, and marketing.",87,4,85,693,53609,135,0.012926933910350874
138,You're anxious because your mind is living in the future while your body is stuck in the present. The gap between where you are and where you think you are is too large for action:,128,29,778,5515,426667,2390,0.012925771151741287
826,"You can change.
No matter how painful.
No matter what your mind tells you.
No matter how much you want to cling to the comforts of your current life that are causing more destruction than you think.",110,8,177,1099,85079,161,0.012917406175436947
780,"The most optimal way of doing something is the one that you enjoy but still gets results.

The least optimal way of doing something is the one that is perfect but you can’t stick to for more than 2 weeks.",102,7,82,753,58310,74,0.012913736923340765
655,"The gym is an incredible teacher.

When you're on the last few reps of a heavy lift, questioning your sanity, you experience a quality of human consciousness that is rare and hard to replicate.

The deepest crevices of reality are where you collect the most valuable lessons.",68,9,114,882,68322,73,0.012909458154035304
460,"When you judge something you close off your ability to understand.

“He’s a republican”
“She’s a democrat”
“He said this”
“She said that”

As if one label or act composes the microcosm of life that they are.

Snap out of it.",102,13,92,769,59601,52,0.012902468
356,"If you don’t know what to write, start with what you love to learn.

The books that have changed your life. The videos you click and binge watch without hesitation. The conversations you have with the few friends that understand you.

Lean into what makes you, you.",133,21,246,2004,155559,442,0.012882572
918,"Step 1) Improve yourself
Step 2) Share what you did
Step 3) Improve others

I have yet to see somebody fail when they don't skip number two.",83,8,143,1097,85343,127,0.012854012631381601
1052,"Overworking yourself is the destroyer of self-awareness, creativity, and thinking positively into the future.

Psychologically, your attention doesn’t have a chance at engaging in the restful activities that would activate those networks in your brain.",119,6,121,892,69402,83,0.012852655543067923
856,You can slice 8 hours of work into 3 if you learn to focus.,115,10,138,1275,99222,129,0.012849972788292918
1081,"You suck at writing because you don’t understand psychology. People don’t want to be lectured, they want to be understood.",187,18,338,3277,255461,465,0.012827789760472245
1182,"You feel bad because the person you want to become is watching your moves, and they don't like what they see.",200,37,433,2932,228723,280,0.012818999401022197
960,"Entrepreneurship is the only logical option for long-term thinkers.

People climb corporate ladders because their psyche craves challenge.

It's rewarding.

But you can only climb so high. The challenge will cease to exist.

Cut to the chase and start building your own thing.",110,7,175,1357,105883,171,0.012816032790910722
1227,Self-education is a lifelong practice that shields you from the threat of replacement.,130,18,281,1970,153758,84,0.012812341471663264
1205,"If you don't know what you want, you need experience.

You need to execute on what you think you want.

Pick something and move.

You don't know what you want because you aren't aware that something you want exists.",147,16,215,1313,102648,180,0.012791287
1170,"Control what you can control, which is almost everything, because you control your perspective.",170,17,399,2167,169427,95,0.012790169217421073
220,"Day 1/3 for recording the audiobook of The Art Of Focus is done.

My voice is shot and brain is fried.

Paperback and audiobook go live early January. https://t.co/OE6hFGJccH",64,1,10,400,31275,13,0.012789768185451638
779,"If you don't feel the urge to highlight every line of the book you're reading, it wasn't written for you at the phase of life you're in.

Pick up a different book.",180,31,266,1841,144008,150,0.012784011999333371
949,"Your future will be determined by 3 things:

1) One big decision to go all in.

2) Repetitive and focused daily action.

3) The ability to persist, iterate, and stick out the guaranteed lows on your journey.
https://t.co/pG7VHx8TzS",47,6,153,948,74167,264,0.012781965024876293
1142,"A creator is still one of those paths that people don’t see as “real job.”

Few people realize most “real jobs” will merge and collapse because people will continue to demand more out of life.

A creator is one that against all odds, leverages the internet for fulfilling work.",127,4,84,875,68464,64,0.012780439354989483
897,"Self improvement is about solving your own problems.

Business is about solving others' problems.

The creator economy is where you do both:
https://t.co/kNNmBNMQyW",44,0,55,539,42240,73,0.012760416666666666
1150,"Yes, you can do nothing with your life.

Nobody is going to stop you.

But, you won't escape survival.

By doing nothing, the default outcome of your life will be mindlessness, chaos, and destruction.",143,10,151,1045,81977,75,0.012747477951132635
249,Writers are DJs but with ideas instead of songs.,135,12,81,747,58671,42,0.012732014112593957
867,"If you don't create a career, society will give you one.

If you don't create a purpose, society will give you one.

If you don't create an identity, society will give you one.

Every bit of information you process is programming your mind for success or failure. Be intentional.",158,24,526,2434,191799,413,0.012690368562922643
1179,"I've helped over 5000 creators (not including free content here).

The more I help, the more I realize there is no competition.

You don't apply for a job, you create one.

You don't find a niche, you create one.

It's in the name.

A creator, as nature intended.",130,10,85,1165,91843,112,0.012684690177803425
1178,"Hype your friends up when they are trying to change. And, if their improvement threatens your mediocrity, maybe you should join them.

The world doesn't need more crabs in a bucket.",168,36,584,2630,207494,112,0.012675065303093102
1129,"Passion isn't found.

It's created by setting a personal goal and exposing yourself to the skills, tools, and ideas that help solve problems standing in the way.

If life lacks passion, it's because you're chained to building someone else's dreams instead of your own.",93,12,256,1229,97023,188,0.012667099553714067
1232,"Don't set a new years resolution.

Use this quiet time to reflect on your past. The chapters of pain, progress, and uncertainty. These are fingers pointing toward purpose.

Avoid following the 91% that don't achieve their goals.

Gain clarity, be decisive, and act with intention.",60,9,309,1394,110183,141,0.012651679
1171,"Play the game of getting rich while staying honest. That's what makes it fun. Anything else, in your mind, should be considered cheating.",125,9,217,1566,124169,73,0.012611843535826173
687,The art of focus book coming soon https://t.co/apdaemnylt,37,2,25,345,27362,23,0.012608727432205247
533,"If you believe that anything more than 1 focused hour a day is needed to see success, then 99% of people will never see it in their lives.

If you can’t make short bursts of progress, you’re doing the wrong things. If you have to work long hours, you’re doing the wrong things.",126,2,141,1174,93388,219,0.012571208292285948
765,"Good writing demands abnormal experiences. It's difficult to generate gripping ideas if you aren't pushing the boundaries of what you know.

Hit new lows.
Hit new highs.
Extract the lessons from each and let your words transfer what you felt to those that need it.",79,8,70,580,46210,58,0.012551395801774508
1141,"Signal is subjective.

What's noise to you is signal to another.

Life is a single-player game, and your path won't be the same as your peers.

Don't let them project what's important to them on you.",112,11,68,601,47910,29,0.012544353997077854
570,"If you want anything rare:

- High quality relationships
- Making a lot of money
- A top 1% physique

Then it’s obvious that you have to take a rare path.

Most understand this, but they get programmed into an average life and lose sight of the goals that used to excite them.",153,20,513,3022,241178,627,0.012530164
1060,Self-comparison becomes inspiration when you detach from the outcome.,79,2,53,623,49727,26,0.012528405091801234
821,"Growth demands sacrifice.

It hurts, but you won't be able to reach new levels if you cling to the friends, ideals, and environments that chain you to your current way of life.",149,4,275,1417,113188,170,0.012518994946460756
1117,"You are one post, message, or share away from reaching the people that will change your life.

There are 4.9 billion people on the internet, and all you need is 1000 to see your value.

Every person on this Earth can get paid a sustainable income from a fraction of the internet.",134,10,134,1142,91323,119,0.012505064441597408
788,"Might lose my masculinity card here but the book is finished. And every time I reflect on the 2.5 years of scrapping draft after draft, giving up for 6 months, and finally piecing the ideas together - I choke up and get a bit teary eyed.

I can’t fucking wait to share it with you",244,5,34,1368,109420,33,0.012502284774264303
931,"Write your drafts on a walk.

(Yes, this is the only acceptable time to be looking at your phone while walking.)

Pick a path where you won’t run into things.

Thank me later.",99,2,35,578,46273,60,0.012491085514230761
1251,You're bored because you haven't developed a skill set that allows you to take on interesting challenges.,147,30,575,3439,275367,336,0.012488788
725,"How to outperform most people:

1) Repeat the boring fundamentals
2) Let everyone else drown in tactics

You need 1-2 months of momentum before you see any meaningful results.

If you don't control your attention, you will keep starting over when you find a new shiny tactic.",149,10,340,1891,151503,543,0.012481601024402158
748,"Start small.

You, your genuine interests, and the skills necessary to make an income.

Writing, speaking, marketing, and sales.

Talk about it all on the internet.

Attract a readership.

Create a product that your past self would have wanted.

You can figure out the rest.",85,4,148,1042,83504,263,0.012478444146388197
999,"If you don't have goals you don't have a lens to view life from. Opportunities will pass you by and you'll be clueless as to why ""life isn't fair.""",140,5,113,1012,81186,91,0.012465203360185254
955,"Your life is the ultimate portfolio of investments.

Your mind, body, and business all require long term thought and strategic effort to grow.

Focus is a currency and 100% of your actions are how you invest it.",145,9,203,1326,106426,175,0.012459361434235995
1235,"It is dangerous to assume that negative thoughts, emotions, and actions aren’t supposed to be a part of life.

It is even more dangerous to let their ramifications go unrecognized, so that you never seek to improve.",80,3,108,722,58002,41,0.012447846625978415
838,"It's going to take years.

Be okay with that. And when you feel like you aren't getting the results you want, gain perspective.

If it takes 4 years to get a degree and an additional decade to climb to a decent salary, it will take more than 2 weeks to succeed at your own thing.",165,15,321,2045,164349,283,0.012443032814315877
884,"Build the solution that solves your problems to perfection.

Write the content that speaks to the person going through that problem.

Sell the solution with your personal experiences with that problem.

Build, write, and sell to yourself if you want to eliminate all competition.",70,2,87,688,55319,211,0.012436956561036895
1241,Luck is a percentage that increases with the number of people that know your value.,110,14,266,1651,132794,111,0.012432790638131241
333,"If you want to:

- have better ideas
- burn more calories
- reflect on your week
- have a mobile work block
- remove distractions instantly
- create time for podcasts or books

Go on a walk.

There aren’t many things simpler than walking that bring as many benefits.",190,18,311,2514,202412,380,0.012420212240381005
1104,"People aren't judging you as much as you think they are.

And if they are, they'll forget about it when the next distraction pops up.",183,22,329,1978,159332,110,0.012414329827027842
1064,"Focus.

Scrolling isn’t going to sculpt that body.

Tutorials aren’t going to build your business.

Notifications aren’t going to bring you peace.

Only a meaningful goal, clarity on how to achieve it, and unbreakable focused effort can do that for you.",149,12,295,1876,151198,251,0.012407571528723925
800,"With the book, any product I've built, or skill I've learned there has never been a moment where I am 100% certain on what to do.

You set a direction, move, and slowly figure it out week by week until you look back and realize the progress you've made.",80,4,58,582,46910,67,0.012406736303560009
1068,"One pattern I've noticed recently (in myself and my connections).

People will buy our products or services and say:

""I saw like 20 other people offering the same thing, but yours made the most sense. It spoke directly to me.""

Sense making + being yourself = how you stand out.",155,3,102,972,78346,114,0.012406504480126618
792,"Imagine having a mind with limits that have yet to be reached by any individual human

And limiting it to social media, TV, work you hate, and cheap pleasures that are laid in front of you like cheese for a rat.

You were meant for more.",126,14,140,921,74298,105,0.012396026810950497
1050,"The Perception Threshold:

After a period of struggle, what was once difficult becomes effortless due to a shift in how you perceive the situation.",129,6,124,900,72690,79,0.012381345439537762
1162,"Your problems never go away, you just get better at solving them.",338,63,1171,5049,408367,149,0.012363878570011779
758,"Over the years I've moved away from strict routines because of the obvious flaw that you feel bad when you deviate from it.

I've found that having a loose structure that I can flow within has led to the best results.

Most people are ""optimizing"" for no reason of their own.",207,13,89,1137,91963,99,0.012363667996911801
839,"“9/10 businesses fail!”

Okay then start 10 businesses.",150,21,191,1717,138904,76,0.012361055117203248
812,"Brand is you.

Product is what you needed on your journey.

Marketing is the valuable lessons you picked up along the way.

When you compete with yourself you eliminate competition.",111,7,134,999,80839,212,0.012357896559828796
586,"The best way to generate writing ideas is to zoom out one layer beyond a notable situation.

When you're having a good conversation, what's the underlying lesson?

When you feel good or bad, why? What actions led to that feeling?

The best writing is relatable self-reflection",69,0,33,438,35451,78,0.012355081662012355
642,"Threads feels exactly like Twitter when I first started out.

I like where Twitter is going, but I started to miss a platform that prioritized short-form constrained writing.

That's what made Twitter worth it to me.

It made me a clear, concise, and impactful thinker.",46,2,10,274,22212,6,0.012335674410228705
992,Business is the modern vessel for living with purpose.,112,7,89,784,63562,42,0.012334413643371825
1126,"Business is just getting paid for your contribution to the future, hopefully a better one.",109,4,109,932,75728,31,0.012307204732727657
791,"You can do 8 hours of work in 2 if you:

- Feel the pressure to escape your current situation.

- Have a clear plan of attack toward a meaningful goal.

- Internalize a purpose that brings meaning to your work.

With pressure, a plan, and purpose you become indistractable.",121,6,187,1242,100954,321,0.012302633
1062,"Selfish reasons I started a business:

- To not be given orders
- To go to the gym at 2pm
- To never have to wear a suit
- To prove everyone else wrong
- To be able to afford Chipotle every day

Stubborn personal motivations can be more powerful than materialistic ones.",205,25,217,2512,204250,349,0.012298653610771114
1016,"You need 3 activities:

One that makes you money.
One that brings you peace.
One that keeps you fit.

There’s a million different options for each.

The fun part is experimenting with them all, choosing the one you enjoy, and creating a sustainable lifestyle over the next decade.",109,22,402,2208,180014,409,0.012265712666792583
815,"Writing is a great skill to learn because it pairs with any other skill or interests.

If you can write, you can do whatever you want and distribute the value you discover from those pursuits.

Writing allows you to make a living from living. The problem is that most people arent",159,14,126,1142,93114,131,0.012264535945185472
312,"Your life sucks because your standards for your life suck.

You're okay with $0 in your bank account.

You're okay with eating junk food every meal.

You don't have goals that make you feel the pain of not making progress.

Create better standards:
https://t.co/1rxg7i12Q5",66,4,79,716,58578,192,0.012223018880808494
832,https://t.co/s16QYdEMxE,32,6,75,614,50246,42,0.012219878199259642
281,"Self-discipline is when the desire to become the highest version of yourself outweighs the desire for cheap pleasures.

A thread on reaching your potential:",159,97,3243,18792,1542416,9312,0.012183483573821848
1193,"Your limitations are self-imposed.

If you want something, there's always a way. But, your ego is working overtime to distract you from your potential. 

Question everything, especially your beliefs about what's possible.

Once you see it, you can’t unsee it.",132,17,283,1545,127040,181,0.012161523929471034
969,"You need to focus your energy.

Meaningful goals.
Promising side projects.
Results-generating tasks.

The world is more distracting than ever.

If you don't protect your attention at all costs, your energy will be drained and you'll think that's your 'normal' state of living.",115,13,316,1683,138552,300,0.012147063918240083
782,"Being too smart makes you dumb because you analyze your way out of lessons birthed from action.

Being too dumb makes you smart because you learn from the mistakes that came from not caring about the risk.",138,13,174,1189,97922,134,0.012142317354629195
816,The answers to your problems are obvious. https://t.co/w49Muus0dI,35,6,102,624,51416,151,0.012136299984440642
50,"If you love:

- Pursuing your curiosity
- Setting your own goals
- Self-experimentation
- Self-improvement
- Self-education

A never-changing job isn't going to bring you fulfillment (but can be a good stepping stone).

Here's an alternative route:
https://t.co/DOhPqUsE7n",43,3,41,401,33042,175,0.012136069245203074
369,"There is a limit to how big your muscles can get.

But nobody has found a limit to how big your mind can get.

Meaning, there is no limit to what your mind controls:

- How much you make
- How good your life is
- How impactful you are

Train your mind:
https://t.co/TC6l2t3rfZ",52,3,42,502,41373,96,0.012133517028013439
971,"Your social media experience is an amplification of who you are.

If you complain about it being “toxic” or “negative” there’s a reason behind that.

You’re in control of what you allow into your mind.

Most people know this but let their toxic or negative reactions control them.",155,19,188,1318,108647,76,0.012131029848960395
1070,"A creative income is generated by solving profitable problems at the intersection of your skills, interests, and personality.",126,7,201,1294,106679,208,0.012129847486384387
899,"If you aren't directly involved in the transaction and fulfillment of the product or service you aren't getting better at making money.

Entrepreneurship is modern survival and you must learn to hunt.

Your psyche is begging you to use the parts that our world neglects.",49,5,79,656,54096,61,0.012126589766341319
1148,Most of your problems aren’t problems. They’re a temporary emotional wave that normalizes with time.,208,32,575,3181,262576,190,0.012114587776491378
850,"Set a goal.
Achieve the goal.
Market the goal.
Sell the solution to achieve the goal.

Stop overcomplicating how to make meaningful money.

The most profitable niche is you:
https://t.co/75cLxC2WMq",39,2,67,649,53597,169,0.012108886691419296
1196,"It is impossible to know with absolute certainty what is going to happen in the future.

This is why the masses flock to ""secure"" jobs and belief systems. It's an illusion of certainty to avoid struggle.

You can't skip making mistakes.

Mistakes are your light in the dark.",130,16,149,1136,93986,78,0.012086906560551572
669,"How to never be criticized:

Never change
Never pursue goals
Never live with purpose
Never put yourself out there
Never question what you're told
Never publish your creative work

Never do anything that makes people realize they aren't doing anything.",138,21,206,1204,99721,179,0.012073685582775944
1172,"You need a plan.

There isn’t any other way.

Because if you don’t have one, society does, and they’ve been planning your life for decades.",198,24,545,2621,217209,221,0.012066719
391,"The internet has made it possible to monetize the knowledge in your head.

There are 3 daily habits you need:

- Learning
- Building
- Distributing

If you aren't afraid to make mistakes (and improve from them) you will do just fine.
https://t.co/uSSuXBPrk7",52,2,56,537,44513,142,0.012063891
953,"Most people would be better off waking up early, even if they're a night owl.

80% of your bad habits happen after 8:30pm.

If you went to bed early, you would avoid them and see a jump in quality of life.

But that's why people don't do it.

They're addicted to feeling terrible.",198,28,227,1835,152173,201,0.012058644
555,"99.99% of people are a slave to something.

- Sex
- Money
- Their phone
- Restrictive routines

But wage slavery is the most dangerous of them all.

(don't get your panties in a bunch just yet)

Here's how you escape:
https://t.co/TkVlukbsSR",40,3,71,550,45650,195,0.012048192771084338
777,"Most people think that feeling ""lost"" is a bad thing.

So they dwell on it, stress over it, and lock themselves into that feeling.

The best thing you can do is let go.

Take it easy.

Let a vision for your future form.

And when you gain clarity, build.",184,11,181,1357,112794,133,0.012030782
1168,"There’re phases where 3-4 hours of work is enough.

But then there’s periods where a new possibility presents itself, absolute clarity is reached, and 16 hour days become automatic.

Work becomes play.

Everything else becomes distraction.",106,7,161,1342,111616,124,0.012023365825688073
483,"The bad thing about building a large readership is that people treat you like a sculpture in a museum rather than a person on the street.

The good thing is that it forces you to ignore everything except what's important to you, or else you won't get anywhere meaningful.",102,0,36,634,52743,33,0.012020552
