,tweetText,replyCount,quoteCount,retweetCount,likeCount,views,bookmarkCount,like_to_view_ratio
1084,"Persuasion is to open minds to the potential of mutual benefit. Manipulation is to close minds to a singular option, often benefiting the manipulator.",70,4,137,785,72623,85,0.010809248
784,"You can change.

No matter how painful.
No matter what your mind tells you.
No matter how much you want to cling to the comforts of your current life that are causing more destruction than you think.

There is an art to self-architecture:
https://t.co/MzLyXqCWQy",52,5,54,447,41367,96,0.010805714700123287
932,"I feel bad for the people that think self improvement is a joke.

(not the ones that joke about it, but the ones that write it off entirely)

Logically there is only one other option if you aren't improving, even by a marginal amount, every day.",120,6,84,819,75796,37,0.010805319541928335
1230,"Get excited over the small things. The bland but healthy food. The difficult but rewarding last rep. The uncomfortable but necessary silence of being alone. All of it.

The highs, lows, bigs, and smalls of life are going to pass whether you enjoy them or not.",105,13,299,1793,166569,150,0.010764308
1144,"Your content sucks because you don't:

- Hook in the reader
- Agitate their problem
- Relate to their problem
- Give them a valuable solution

Human psychology will always beat what you think will work.

Clear, not clever.",128,6,128,1156,107500,373,0.010753488372093023
1092,"Many people make a drastic change in their life, experience a positive feeling, and become dogmatic about the method used.

Like adopting a specific diet ideology.

Yes, cleaning up your diet helped with energy.

But, the clarity from being disciplined is what helped the most.",80,7,46,556,51718,39,0.010750609072276577
714,"Nobody wants to face the fact that negative emotions are a part of life.

Hiding from them will only bring you more pain.

Instead, use them as rocket fuel.

Channel them towards a meaningful goal:
https://t.co/MBxRtAIFsO",71,5,34,381,35454,42,0.010746319174141141
146,"Society is a behavior system.

Your mind has been conditioned to operate efficiently according to the goals of society.

This is necessary for us to operate together, but when gone unnoticed leads to a mindless and mediocre life.

How to take control:
https://t.co/M1kAUkbIyq",59,2,53,490,45885,213,0.010678871090770405
1234,The source of learning is struggle not memorization.,137,35,446,2675,251022,184,0.010656436487638534
930,"Stop thinking of content as a means to income.

Will your ideas be mentioned in a top 10 podcast episode?

Will your ideas be in the intro of a best selling book?

Will your ideas be mentioned in viral videos and tight knit newsletters?

Write for impact and the income will come.",92,6,124,1089,102311,168,0.010644016772390066
1176,"It's interesting to think that hot weather can make someone go insane. But, that same person can go into a sauna without complaint.

Your expectations for how life ""should be"" prevent you from seeing it for what it is.

And once you do, you can start making true progress.",110,12,77,633,59726,29,0.010598399357063925
854,"How to not end up mediocre:

- Question who you are
- Question your actions
- Create your own goals
- Create your own actions
- Execute with a conscious mind daily

The good life belongs to those that create it:
https://t.co/7P6TrWzJwE",42,4,113,638,60273,192,0.010585170806165282
5,"Society is a behavior system.

The goals of going to school, getting a job, and retiring with just enough money to survive until death are programmed in the minds of everyone.

You are scolded for doing otherwise.

There is a matrix, here's how you escape:
https://t.co/Wl8H4WWz63",60,3,50,425,40232,176,0.010563730363889441
1110,"If you are a writer that struggles to:

- Generate frequent ideas
- Write in an impactful way
- Stay consistent with posting

You need a system.

Create one place to capture ideas.
Immerse yourself in good writing.
Create a weekly posting schedule.

Make it habit.",100,5,80,768,72705,122,0.010563234990715906
1213,The switch from consumer to creator is the switch from getting distracted to hunting for ideas.,141,20,330,2428,230195,212,0.010547579
684,"To creators that are afraid to talk about their interests:

1) You are interested in your main niche (obviously).

2) You follow 200-500 other people with varying interests.

How can you believe that you have to stick to one interest when YOU follow 10-20 different interests?",48,4,33,511,48500,133,0.010536082474226804
956,"Identity influences perception.
Perception influences choices.

It’s not wise to judge a book by its cover, but you can tell a lot by the way someone looks, dresses, and stands because it’s an external display of their identity.",118,5,115,823,78209,79,0.010523086
760,"The people I respect all share the greatest fear:

The thought of waking up one day after a life lived on autopilot, wondering where the time went, with little time left to make up for what they lost.",136,10,185,1287,122324,201,0.010521239
295,You feel terrible because your subconscious knows you could be doing better. A thread:,121,131,2502,15235,1454544,6777,0.010474072974072974
996,"Human life is smack in the middle of animal and spirit with the mind as the bridge.

You have two options in every situation:

1) Go beyond yourself and create

2) Regress into your animalistic nature

Both are difficult.

The former results in a deep sense of satisfaction.",76,2,62,506,48350,37,0.010465357
485,"3 years in the making.

The Art Of Focus book is finally launching.

But, we're doing things differently.

Not just a paperback that you leave on your shelf to collect dust.

More info is on its way.

Join here so you don't miss updates:
https://t.co/DfD6JgQcHo",53,2,34,461,44087,31,0.010456597182843015
915,"If you don’t create a career, you will be assigned one.

And if work consumes about 25% of your life, you may not enjoy a quarter of your existence.",146,9,261,1663,159049,179,0.010455897239215587
979,"If you can spend 8 hours building someone else's dream, you can spend 1 hour building your own.

8 hours of pay on the same repetitive tasks puts a limit on your income.

1 hour of zero pay on lever moving tasks removes that limit:
https://t.co/m7cjtd8E6d",45,7,113,762,72935,248,0.010447658874340167
398,Surreal. https://t.co/WibyxQULRe,367,32,427,6496,622113,1302,0.010441832914599117
314,"People will grind out 1000s of hours over the course of years in a game to max out a bar on a screen for nothing tangible in return, but won't do the same in life because the fear, risk, and uncertainty that comes with progress is real. Even when the amount of effort is the same.",184,30,311,2209,211788,377,0.010430241562317035
121,"If you don't create a goal, you will be assigned one.

Society is a behavior system that assigned you schools and jobs to achieve the goal of a functioning (yet mindless) population.

Your mind is a system that helps you achieve your goals with time:
https://t.co/hA3f3jWjS8",41,7,58,519,49798,238,0.010422105305433953
308,"Success comes down to 3 things:

1) What you do.
2) People knowing what you do.
3) If what you do is valuable to the people that know what you do.

99% of people lack number 2.

Social media is the catalyst to modern success (if you know how to use it):
https://t.co/8qlHs1CCm4",77,6,62,545,52293,193,0.010422045
1119,"There are 2 types of happiness.

One is derived from achieving goals. The second is derived from achieving nothing.

But, this balance of peace and progress has to be upheld by a sense of mastery.

Otherwise, it becomes a shallow pursuit that will leave you disappointed.",94,2,82,610,58738,59,0.010385099935305935
548,"The new rich isn’t about houses, cars, and watches

(Not saying these are bad things to acquire)

The new rich is a fulfilling lifestyle created with new technology, autonomous schedules, and purposeful work.

Here’s how to take advantage (3 minute video):
https://t.co/Dv02UjIuLm",46,4,50,450,43365,138,0.010377032168799724
515,"I've been reading 2 related books at the same time.

One audiobook on walks. One physical book before bed.

The pattern recognition between the two is incredible.

It helps you notice and filter the important lessons from the books' topic.

Worth a try.",120,7,68,1046,100919,131,0.010364747966190708
1225,"Spirituality is a process, not an ideology.

A ""spiritual"" person is someone in practice. They won't always fit the mold of what you believe a spiritual person to be. It is a never-ending journey of cultivating awareness of their unconscious thoughts, actions, and reactions.",69,11,99,674,65114,48,0.010351076573394355
569,"Observation:

Most smart people I know, when they want to learn something, immediately Google what they want to learn and go down a rabbit hole.

Everyone else asks for all information to be given to them, rarely get a complete answer, and get distracted within 5 minutes.",197,54,551,3524,341140,549,0.010330069766078443
968,"Most people don’t need more advice. They need more powerful ideas to shape their worldview and frame their decision making. That way they can make better choices, figure it out for themselves, and reap the dopamine that comes from trial and error.",76,9,121,789,76380,118,0.010329929
1055,Build stuff and put it in front of people.,162,14,197,1465,142180,75,0.010303840202560135
206,"Time under attention:

The amount of attention you hold with each piece of content X quantity of content X quality of content X how often your ideas live in their head X how much they spread your ideas without effort = the authority, profitability, &amp; power your brand holds.",59,2,32,399,38771,94,0.010291197028707023
502,"The difference between you and what you want is skill.

The internet has leveled the playing field. You have direct access to the information that can change your life but you continue distracting yourself.

Spend 30-60 minutes a day learning these skills:
https://t.co/O2w3sH69zD",25,3,46,391,37999,175,0.010289744466959657
741,"The difference between vanity and aesthetics is depth and appreciation.

Vanity as a value leads to suffering by self-comparison.

Aesthetics as a value leads to present-moment enjoyment by observing the beauty that often goes unseen in a world chasing the next quick fix.",52,6,58,460,44802,47,0.010267399
1036,"Power belongs to those that accumulate the most attention in their lifetime. Not in the sense of vanity, but in the sense of value.",55,3,71,601,58695,57,0.010239373030070704
530,"Nobody cares...

But you still care (a bit too much) about what other people think.

Anytime you approach a goal the thoughts start to flood in.

They distract you from making progress.

If you lack self-confidence, here's the solution:
https://t.co/XVCsPgkdCA",45,3,48,378,36927,129,0.010236412
1123,"You don’t want absolute freedom, you want autonomy. The difference is that freedom implies a lack of structure, where autonomy is your ability to choose within a structure.

Hopefully, one that is composed of a vision, evolving purpose, and meaningful problems worth solving.",206,40,319,1871,183046,168,0.010221474383488303
1222,Life is not kind to those that don’t know what they want out of it.,147,20,300,1912,187280,137,0.010209312
1097,"The trait of persistence can only be appreciated when you try to accomplish something big in your life.

Mediocre people love to label the trait as “cliche,” ignore its profound importance, and go back to whatever they weren’t doing.",153,8,95,891,87472,65,0.010186116700201208
732,"“How do I start?”

By starting, my friend.

(Advice is not starting).",157,16,149,1370,134520,118,0.010184359203092477
1011,Internalizing feedback from more than 2-3 people is the easiest way to get lost.,78,6,43,593,58247,33,0.010180781842841692
1074,"3 ways to launch yourself into a season of progress:

1) Watch your peers surpass you and get mad that you haven't kept up.

2) Realize where your actions are taking you and sit with that potential future.

3) Immerse yourself in an environment of growth and improve by osmosis.",111,8,113,945,92982,148,0.010163257404658966
23,"I'm not a fan of the term ""make money online.""

It attracts those looking to make a quick buck, and if they don't, they quit and return to the ""safe"" route.

The only safe route is building your life's work. Which will probably use one of 7 methods online:
https://t.co/PSLFcTQTQy",48,0,11,366,36033,178,0.010157355757222547
1095,"The distraction/inaction dynamic is literally the only thing holding people back. 

All day long exhausting themselves with mental gymnastics as to why they should do anything but improve themselves.

If you can fix that problem, you win.

No amount of advice can fix it for you.",130,12,146,1086,107184,177,0.010132109270040305
762,"We're in the middle of the second Golden Ages.

You can learn any useful skill online.

You can build a readership around your interests.

You can reach more people than any ancient philosopher could in their time.

Don't waste it:
https://t.co/zzSxBe9fzL",47,3,40,479,47334,108,0.010119575780622808
477,"Started running 3x a week again and think I got too lean (eating 4500 cals a day).

Good lighting and a pump works miracles https://t.co/Pd1JLEcij8",128,5,5,495,48935,44,0.010115459282721978
370,"If you want to do anything worthwhile, you aren’t going to learn how by asking someone else.

They can’t give you 5 books worth of information in the 10 minutes you talk to them.

Every single person you admire had to:

1) Start

2) Not have all the answers

3) Obsess over finding them for months

4) Bang their head against the wall and almost quit

5) Stick it out long enough to have the “aha!” moment (this could take years)

6) Stack enough skill and experience to know exactly what to do (you don’t notice how skilled you are becoming along the way)

Asking people for answers can push you to make the first 10 tiny decisions toward a better life, but there are still 100,000 more to make - and they must be unique to you.",116,11,175,1296,128313,489,0.010100302
390,"A testament to exponential growth.

My first year of writing: 10,000 followers.

My second year: 50,000 followers.

My third year: 100,000 followers.

(Doubled down and diversified platforms).

My fourth year: 2,800,000 followers.

And you want to quit after 6 months...",225,16,122,1778,176084,216,0.010097453
1093,Unhappiness is the lack of being or doing because of thinking.,224,23,368,2550,252918,230,0.010082319170640286
975,"You can't do what you love because you don't have the skill to make it happen. That's it. Anything else is an excuse, limiting belief, or lack of awareness of what's possible.",133,10,213,1507,149574,165,0.010075280463182104
656,"Imagine your life as a spreadsheet.

It would display every single thing you've ""paid"" attention to down to the millisecond.

Thoughts, distractions, emotions, tasks, money, family. Negative or positive. Conscious or unconscious.

It would show you exactly why your life sucks.",65,10,101,731,72574,132,0.010072478
285,"Your life sucks because of the thousands of tiny choices you made over the past year.

Your quality of life 1 year from now depends on the thousands of tiny choices you make starting now.

Here's how to take back control of your life:
https://t.co/rzcVkq84n0",49,5,64,550,54663,237,0.010061650476556355
622,"One you have enough resources for yourself and family (which is usually around the $100k/year mark) the mind starts to crave meaning and purpose.

This is evolution at work.

Your focus shifts from selfish to selfless.

You have enough for yourself, so you feel the pull to help your tribe and species as the drive to acquire more resources.

It’s difficult to help others when you haven’t helped yourself.

It’s difficult to find purpose when you’re trapped in a cloud of stress and survival.",120,6,98,983,97779,157,0.010053283
827,"Most people never change.

They reach 18-25 years old and adopt a routine that they repeat for life. Never branching into the unknown. Never realizing their potential.

You don't have to end up like them:
https://t.co/DHUCurjR47",46,5,64,560,55863,181,0.010024524282619981
807,"Nobody can give you the perfect answer that will unlock the insight you need to get to the next level.

It's a slow build up of knowledge, awareness, experience until the ""aha!"" moment hits and you know exactly what to do.

For some it can take a week, for others a few years.",66,11,93,639,63801,103,0.010015516998166173
380,Why does everyone seem like they are never where they are want to be doing what they want to do,264,16,128,1479,147674,128,0.010015303980389237
587,"Full-stack entrepreneurs are new.

You have any and all information at your fingertips.

You don't need to hire a marketer, designer, developer, project manager, etc.

As one person, you can learn skills and leverage software that used to take 10+ employees.",102,7,92,915,91527,183,0.00999705
1258,Goals are invisible guides on what should be a goalless journey.,47,1,23,354,35414,12,0.009996047
951,"The 8 human desires are:

- Survival
- Life enjoyment
- Freedom from fear
- Sexual companionship
- Comfort and clarity
- Perceived status
- Safety of community
- Social acceptance

Everybody's ""niche"" is self-actualization.

Improve yourself &gt; document solution &gt; improve others",99,16,183,1289,129235,440,0.009974078
449,"You were assigned a life direction at birth.

Your parents, teachers, and friends projected their limited potential on you.

This narrows your mind and makes life miserable.

The cure is to open your mind and become multidimensionally jacked:
https://t.co/TZL8YabwDJ",38,5,29,373,37400,97,0.009973262
1200,"The people that say they don’t need a clear plan are the same ones asking me why they are overwhelmed, anxious, and uncertain about the future of their business.",169,18,104,1103,110683,63,0.009965397
929,"Just got off the phone with my dad.

He got into some financial trouble.

We're both stubborn with asking for help, and I could tell he was choking up asking for money from his son.

Wired it over instantly.

Had a heart to heart.

Two wannabe macho men getting teary-eyed.

Felt incredible to help the man that raised me.

I'm not usually the type to share these things but felt compelled to.

Hope everyone that is in the business game can experience helping their parents without a flinch, especially when we don't come from much.

It's impossible for money to ""pay back"" what our parents did for us. But fuck man. Different feeling. One of those things you'll remember for the rest of your life and hopefully be able to do again and again. Can't explain it.",319,21,151,3191,320748,174,0.00994862
1009,"Life is difficult because you expect it to be easy.

Goggins enjoys brutal workouts.

Jocko wakes up at 4am without complaint.

Wim Hof plunges into thermoshockingly cold water.

You can sit down at a computer and build.

This will make it easier:
https://t.co/SFySHos9gO",50,4,73,797,80114,143,0.009948324
711,The Art of Focus book coming soon https://t.co/R11LSbCryY,66,11,23,485,48757,53,0.00994729
766,"If you're lost, you need clarity.

When you have clarity, prepare for intensity.

After intensity, prioritize consistency.

And when you flip to the next chapter of life, know that you will feel lost again.

https://t.co/mgpSLojmpk",48,7,130,806,81121,239,0.009935775
636,"How to be original:

Don't.

You have a mind that has perceived billions of bits of information in any passing moment that is vastly different from anyone else.

Consume information, interpret it through your perspective, create:
https://t.co/CocvhS5nfM",34,2,54,410,41356,113,0.009913918
1086,Inaction signals that you value comfort over your goals.,200,33,434,2742,277619,298,0.009876846
1186,The difference between good dopamine and cheap dopamine is progress.,144,16,477,3201,324933,234,0.009851262
1134,"The secret to self-discipline is to avoid environments that make it difficult, and create environments that make it effortless.",217,64,1009,4377,444430,374,0.00984857
1038,"Having systems in place for people to use your product is just as, if not more important than selling your product.",88,0,38,543,55277,46,0.009823254
163,"A personal brand is a way to practice all of the skills necessary to build a profitable business (without having one).

It becomes your public resume.

Then, you can help people with the skills you learned, get results, and start the business from there:
https://t.co/6c3qy6ToBJ",42,0,41,400,40822,161,0.009798638
1118,"The barriers to opportunity 20 years ago:

- Your college
- Your network
- Your location
- Your job title
- Your socioeconomic status

The barriers to opportunity today:

- The internet

Your network is your networth, and millionaires are one tactical DM away.",141,9,119,964,98404,122,0.00979635
1030,"Happiness is a skill.

Nobody can give it to you.

It is a state of mind that you are responsible for creating in your life.

If you're stuck in a rut, watch this:
https://t.co/luUNqaRuP8",61,5,41,465,47480,73,0.009793597
268,"I ""failed"" at web design, SEO, graphic design, digital art, content marketing, dropshipping, photography, multiple ecom brands, and more.

And yet, every single one of those skills culminated into everything I do today.

Here's my story, hope it helps:
https://t.co/IXWCC2G1nO",90,4,75,757,77300,268,0.009793014
1135,"If you want to see a drastic improvement in the quality of your work, work less. And when you aren’t working, do things that keep your attention from floating to work related tasks.

(Source: me, psychology, ancient wisdom, the worlds greatest artists, thinkers, and visionaries)",148,9,153,1259,128735,155,0.00977978
970,Persistency and iteration &gt; consistency and repetition,103,11,152,1068,109416,118,0.009760912
843,"If you aren’t making money it’s because:

1) you don’t have a product or service
2) you aren’t putting it in front of people

That’s literally it.

You can improve along the way and try out fancy tactics to make more money, but none of it will matter without the above.",97,13,167,1242,127846,365,0.009714813
920,"The future belongs to the self improver.

The person that takes responsibility for their future and becomes a fountain of value for those around them.

When done in public, it is almost impossible not to get paid:
https://t.co/5wT3T4ecAU",47,4,79,556,57301,147,0.009703147
1255,"""Learn copywriting!""

""Learn Facebook ads!""

""This skill will make you $10K/month!""

Stop.

One skill isn't going to bring you anything meaningful.

You need a *timeless* skill stack that can be applied to the modern landscape.

Here's The $1M Skill Stack:
https://t.co/61GP4y6DIf",19,1,33,233,24019,115,0.009700654
1069,"There are no wrong feelings, there are only misinterpretations of them.",109,5,108,762,78672,34,0.009685784
1075,"Life is art, and everyone’s a critic.

Every positive or negative “review” you leave on the series of situations you are faced with influences your quality of life.",83,3,64,573,59238,34,0.009672845
614,"The reason people fail:

They seek motivation when they need clarity.

One is external, one is internal.

You must bridge the gap between where you are and what you want with an aim, plan, and execution regardless of how you feel.

Here's what you do:
https://t.co/pd1151L1ly",34,5,67,424,43915,205,0.009655015
1146,"Distraction is the greatest trap of the 21st century.

But, nobody attacks the root problem.

So, they stay glued to their phones no matter how hard they try.

End it once and for all so you can start making progress toward a better future:
https://t.co/nlbevrQRbA",51,4,55,394,41107,79,0.009584742
499,"I've found that having a few big-picture concepts like:

- The one-person business
- The $1 million dollar skill stack
- The 4 hour workday
- You are the niche
- Life is a video game

Give you a high-performing angle to weave in any other interests you want to talk about.

These form the perception of your brand.

It takes some time to develop these, but once you do, you can milk them for eternity.

""Won't that get repetitive?""

Yes, but how does anyone learn anything?

Repetition and conditioning.

People need to be reminded more than they need something new. But they need to be reminded in a slightly new way (novelty = dopamine = attention).

How do music artists attract a large following?

By developing their ""style"" and then using the same in as many creative directions as they can.

They can experiment here and there, but their audience won't like a lot of it until they discover another piece that fits into their brand.

My point:

Test big ideas with your content until one hit.

Double down on that.

Write as much as you can about it. Dissect that topic and make connections with long-form content.

Experiment with new angles occasionally to find more big ideas.

Rinse and repeat until you dominate the mental real estate of those ideas.",68,3,94,915,95596,544,0.00957153
1185,"It’s interesting to think that 1000 years from now, a select few tweets, articles, and videos will be seen as mythical, profound artifacts unburied from the Information Age.",105,5,63,803,84093,22,0.009548952
626,"Most people are living on autopilot.

They were assigned goals by society (go to school, get a job, retire at 65) and didn't question them.

That's how you end up the same as everyone else.

Here's how to program your mind for a better future:
https://t.co/fXisT2nRUF",34,4,54,476,49868,154,0.009545199
